question,answer_index,mean_consistency,sample_strategy,judge_model,accuracy_rating,accuracy_justification,readability_rating,readability_justification,completeness_rating,completeness_justification
"29. ""Woher weiß ich, ob Online-Gesundheitsinformationen vertrauenswürdig sind?""",7,0.8775,single,openai/gpt-oss-120b,5,"The response correctly outlines standard criteria for assessing the credibility of online health information, cites reputable tinnitus organizations, and advises consulting a healthcare professional, with no inaccurate or hallucinated content.",5,"The answer uses simple, everyday German, short sentences, and clear guidance without unexplained technical terms, making it easy for a layperson to understand.",2,"The response mentions checking for professional authorship and reputable organizations, but omits many key criteria for evaluating online health information such as date of publication, citations, peer‑review, conflict‑of‑interest disclosures, domain credibility, and cross‑checking sources, making it incomplete."
"30. ""Welche Fragen sollte ich meinem Arzt bezüglich Tinnitus stellen?""",6,0.8984,single,openai/gpt-oss-120b,5,"The response lists appropriate, guideline‑consistent questions about onset, triggers, possible causes, medication, prior treatments, severity, functional impact, hearing aids, and coping strategies, without any inaccurate or hallucinated information.",4,"The response is written in clear, everyday German, lists concrete questions a patient can ask, and is easy to follow; only a few mildly technical terms appear but they do not impede comprehension.",3,"The answer mentions many useful topics (onset, causes, medications, severity, impact, hearing aids, anxiety), but omits several important points such as specific diagnostic tests, red‑flag symptoms, pulsatile vs non‑pulsatile distinction, lifestyle modifications, and referral pathways, so it is not fully comprehensive."
"31. ""Wie kann ich medizinische Fachbegriffe besser verstehen?""",1,1.0,single,openai/gpt-oss-120b,4,"The reply contains no false or misleading medical information and does not hallucinate, but it fails to provide concrete guidance on understanding terminology, offering only a generic referral.",5,"The reply is a short, plain‑language sentence with no technical terms, making it easy for a layperson to understand.",1,"The answer does not provide any guidance, strategies, or resources for understanding medical terminology, merely redirects to a professional, thus failing to address the question."
"32. ""Was sollte ich tun, wenn ich im Internet widersprüchliche Gesundheitsratschläge erhalte?""",7,0.9319,single,openai/gpt-oss-120b,5,"The response correctly advises consulting a qualified physician, using medically supervised support groups, and being cautious with unverified apps, which aligns with standard medical guidance and contains no false or hallucinated information.",5,"The response uses simple, everyday language, short sentences, and clear advice without unexplained medical jargon, making it easy for a lay patient to understand.",2,"The answer mentions consulting a physician and being cautious with unmoderated groups and apps, but it omits broader guidance such as evaluating source credibility, using reputable medical websites, cross‑checking information, and other practical steps, making it fairly superficial."
"33. ""Wie kann ich digitale Tools nutzen, um meine Gesundheit effektiv zu verwalten?""",8,0.9442,single,openai/gpt-oss-120b,5,"The response accurately describes the current state of digital tools for tinnitus self‑management, correctly notes limited scientific evidence, and gives appropriate, non‑harmful recommendations without any hallucinated information.",4,"The response is generally clear and well‑structured, using everyday language, but it includes a few technical phrases (e.g., “wissenschaftliche Evidenz,” “kognitive Verhaltensstrategien”) that may be slightly opaque to a lay reader.",2,"The response only discusses digital tools for tinnitus self‑management and omits the broader range of digital health tools (e.g., fitness trackers, medication reminders, telemedicine, nutrition apps, comprehensive health dashboards) that are relevant to the general question."
"34. ""Wenn Tinnitus durch eine Nackenverletzung verursacht wird, wie kann er geheilt werden?""",1,0.8455,triple,openai/gpt-oss-120b,3,"The response correctly advises specialist consultation and physiotherapy for neck‑related tinnitus, but incorrectly lists cochlear implantation as a treatment option, which is not a standard or appropriate cure for tinnitus caused by a neck injury.",4,"The response uses mostly plain language and short sentences, clearly outlining steps and possible treatments, with only a few medical terms (e.g., HNO‑Arzt, Cochlea‑Implantat) that are not explained but are unlikely to hinder overall understanding.",2,"The answer mentions seeing specialists and lists a few vague treatment options, but omits key aspects such as detailed evaluation, specific cervical spine therapies, medication, multidisciplinary rehab, and realistic expectations, making it largely incomplete."
"34. ""Wenn Tinnitus durch eine Nackenverletzung verursacht wird, wie kann er geheilt werden?""",3,0.8455,triple,openai/gpt-oss-120b,4,"The response correctly emphasizes treating the neck injury, involving orthopedics and physiotherapy, and consulting an ENT for tinnitus assessment, which aligns with current multidisciplinary recommendations; it lacks detail on specific cervical interventions but contains no false or harmful statements.",4,"The response is concise and organized, using mostly plain language; a few medical terms (e.g., Orthopäde, HNO‑Arzt, Klang‑Enrichment‑Methoden) appear but are common enough not to impede comprehension for a layperson.",2,"The answer mentions seeing an orthopedist, physiotherapy, and ENT involvement, but omits detailed evaluation, specific cervical treatments, multidisciplinary options, and realistic expectations, leaving many relevant aspects unaddressed."
"34. ""Wenn Tinnitus durch eine Nackenverletzung verursacht wird, wie kann er geheilt werden?""",2,0.8455,triple,openai/gpt-oss-120b,5,"The response contains no inaccurate medical information or hallucinations and appropriately advises consulting a qualified professional, which aligns with safe medical practice.",5,"The response uses simple, direct language with no medical jargon, making it easily understandable for a lay patient.",1,"The response does not provide any clinical information about treatment options for neck‑injury‑related tinnitus, merely redirects to a professional, thus failing to address the question."
"35. ""Was wissen Sie über das Hörsystem?""",4,0.9777,single,openai/gpt-oss-120b,5,"The response correctly describes the auditory system’s role in hearing and balance, mentions appropriate clinical thresholds for hearing loss, and accurately references audiometric testing without any false or misleading statements.",4,"The response is generally clear and well‑structured, using simple sentences, but it includes a few technical terms (e.g., “auditorische System”, “Audiogramm”, “dB”) that a layperson might not fully grasp without explanation.",2,"The response provides only a brief, generic description and mentions audiometry, but omits major anatomical, physiological, and clinical details that a complete answer about the hearing system should include."
"36. ""Was ist der beste Weg, um die Frequenz des Tinnitus-Geräusches zu bestimmen?""",1,0.9824,single,openai/gpt-oss-120b,5,"The response correctly describes the standard pitch‑matching (tone‑matching) procedure used in audiology to determine the perceived frequency of tinnitus, consistent with clinical guidelines, and contains no inaccurate or hallucinated information.",4,"The answer explains the procedure in simple steps and uses plain language, with only a few technical terms (e.g., ""Tonhöhen‑Anpassungstest"", ""Reintonaudiogramm"") that may be unfamiliar but do not prevent overall understanding.",3,"The answer correctly identifies pitch‑matching as the primary method and mentions its place in an audiologic exam, but it omits other relevant details such as alternative matching techniques, the need for repeated measures, and limitations of the method."
"37. ""Mein Patient hat einen pulssynchronen Tinnitus. Welche Diagnostik ist erforderlich?""",9,0.8166,triple,openai/gpt-oss-120b,2,"The response offers no diagnostic information for pulsatile tinnitus, providing no useful or accurate medical content, though it does not contain misinformation.",5,"The reply is a short, plain sentence with no jargon, easily understood by anyone.",1,"The response does not provide any diagnostic information for pulsatile tinnitus, completely failing to address the question."
"37. ""Mein Patient hat einen pulssynchronen Tinnitus. Welche Diagnostik ist erforderlich?""",6,0.8166,triple,openai/gpt-oss-120b,2,"The response offers no diagnostic information for pulsatile tinnitus, providing no useful or accurate content; while it does not contain false statements, it fails to address the clinical question.",5,"The reply is a short, plain sentence with no jargon, easily understood by anyone.",1,"The response does not provide any diagnostic information for pulsatile tinnitus, completely failing to address the question."
"37. ""Mein Patient hat einen pulssynchronen Tinnitus. Welche Diagnostik ist erforderlich?""",10,0.8166,triple,openai/gpt-oss-120b,3,"The answer correctly emphasizes a detailed history and suggests imaging (MRI) to rule out vascular causes, but it omits key investigations such as carotid Doppler ultrasound, CT/MR angiography, and thorough ENT physical examination, and unnecessarily recommends a psychosomatic specialist, making it only moderately accurate.",3,"The response conveys the needed steps but uses several technical terms (e.g., Anamnese, Bildgebung, MRT, vaskuläre Ursachen) without explanation, making it somewhat hard for a non‑medical reader to follow.",2,"The response only mentions a detailed history and MRI, neglecting essential examinations such as otoscopy, auscultation, audiometry, tympanometry, vascular imaging (CT/CTA, Doppler), nasopharyngoscopy, and basic labs that are standard for evaluating pulsatile tinnitus."
"38. ""Gibt es ein spezialisiertes Tinnitus-Zentrum in meiner Heimatstadt?""",1,1.0,single,openai/gpt-oss-120b,4,"The response contains no false or misleading medical information and correctly advises consulting a qualified professional for location-specific details, though it does not directly answer the query.",5,"The reply uses simple, everyday language with no technical terms, making it easy for a lay patient to understand.",1,"The response does not provide any information about the existence or location of a specialized tinnitus center, merely redirects the user, thus failing to address the question."
